Haldiram's,Bikaji Foods,Bikanervala,Gopal Snacks,Prataap Snacks (Yellow Diamond)
Inconsistent taste and quality,Taste preferences may vary,High pricing,Quality and freshness issues,Lower brand awareness
Past hygiene concerns,Occasional quality inconsistencies,Strong regional focus (North India),Past contamination incidents,Limited product portfolio
Relatively higher pricing,Limited variety in some regions,Traditional brand image,Negative impact from fire incident,Intense competition
Distribution gaps in some areas,Reliance on specific distribution channels,Limited online presence,Declining financial performance,Vulnerability to raw material costs
Concerns about nutritional value,Concerns about raw material sourcing,Past hygiene concerns,Distribution challenges,Distribution network challenges