Competitor,Overall Rating,CEO Approval,Recommend to Friend,Top Positives,Top Negatives,Branding Score
Bikano,3.5 / 5.0,,,"Skill development, work-life balance","Career growth, salary & benefits, work culture",🟠 Moderate
Bikaji,3.6 / 5.0,0.65,0.62,"Growth opportunity, dynamic environment, brand","Work-life balance, long hours, developing processes",🟠 Moderate
Bikanervala,3.9 / 5.0,,,"Work culture, growth opportunities, management","Work-life balance, salary structure, long hours",🟠 Moderate
Prataap Snacks,3.4 / 5.0,,,"Brand recognition, product quality, growth potential","Work-life balance, compensation, management issues",🟠 Moderate
Gopal Snacks,3.4 / 5.0,,,"Work environment, growth opportunities, culture","Low salary, safety concerns, career growth",🟠 Moderate
